Symbol,Score,Verdict,Reasoning
GEEKAYWIRE.NS,76,Buy,"Undervalued growth micro-cap with solid execution. ROE ~24% (excellent), 5Y revenue/profit CAGRs ~21%/~59%, improving quarterly profits and interest coverage, D/E ~0.7–0.8 (ok), promoter holding 58.5% and rising. Valuation is attractive (P/E ~10.5, PEG ~0.18, P/B ~2.3 with high ROE, EV/EBITDA ~7.7), suggesting >15% CAGR is plausible amid India infra/manufacturing tailwinds for steel/wire products. Key risks: negative FCF, low quick ratio (inventory-heavy), commodity cyclicality, and low liquidity. No clear governance red flags in given data. Suitable as a cautious, staggered buy with position sizing and cash-flow monitoring."
GLOBAL.NS,78,Buy,"Strong multi-year fundamentals and reasonable valuation. ROE ~24% (excellent), revenue/profit CAGR ~22%/37% over 5y, healthy margins, positive FCF (~27 Cr), and strong liquidity (current 5.1, quick 3.6). Valuation attractive (P/E ~12, EV/EBITDA ~9.4, PEG ~1.35, P/B ~2.7) and promoter holding is high at 72%. Risks: small-cap liquidity, quarterly volatility (big spike then decline), unusual net > operating margin (possible other income), and missing leverage/coverage data—monitor client concentration and cash flow consistency. Overall, data supports >15% CAGR potential with prudent position sizing."
NAGREEKCAP.NS,65,Hold,"Pros: Very cheap valuation (P/E ~2.5, EV/EBITDA ~4.7, PEG ~0.03), strong 5Y growth (revenue ~52%, profit ~73%), high margins, promoter holding ~53.5%. These support a >15% CAGR potential if earnings prove repeatable. Cons: Extremely high leverage (reported D/E very elevated; quarterly D/E also high), highly volatile quarterly numbers suggest investment-driven/lumpy income, microcap size with very low liquidity, and implied ROE appears unusually high—likely not sustainable. Interest coverage (~5x) is acceptable, but balance-sheet risk is material. Missing items (cash flow, ROE/ROCE detail, pledge data) are not penalized, but they increase uncertainty. Triggers to upgrade: evidence of sustainable operating cash flow, clearer income quality (less one-off gains), deleveraging or stronger capital base, and steadier quarterly growth. Until then, treat as a high-risk deep-value idea; suitable only for small, staggered tracking positions after due diligence."
AMJLAND.NS,78,Buy,"Strong 5Y growth (revenue ~39%, profit ~32%) with very healthy margins (OM ~33%, NM ~27%) and near-zero leverage backed by excellent interest coverage (~65x) and high, rising promoter holding (~66%) point to solid financial health. Valuation is attractive across metrics (P/E ~11, PEG ~0.35, P/B ~0.98, EV/EBITDA ~4), offering a margin of safety versus growth. Quarterly numbers are lumpy and liquidity is low, so expect volatility and size positions accordingly. Missing ROE/FCF data is noted but not penalized; the available data supports a >15% CAGR potential if execution continues. Key risks: small-cap liquidity, earnings lumpiness; key positives: clean balance sheet, promoter alignment, and undervaluation."
IVC.NS,62,Hold,"Fair valuation and healthy balance sheet, but growth/quality need proof. Positives: strong gross/operating margins, positive FCF (~₹5.9 Cr), very high liquidity (current ratio ~16.5), promoter holding 50.4%, reasonable valuation (P/E ~18.9, PEG ~1.0, P/B ~1.22, EV/EBITDA ~9.5), dividend yield ~3.5%. Cautions: ROE/ROCE low (6.4%/3.6%), 5Y revenue decline, volatile quarterly profits (including a recent loss), low trading liquidity; debt metrics not provided (not penalized). Multibagger potential requires sustained revenue growth >15% CAGR, stable margins converting to ROE >12–15%, and consistent operating cash flows. Watch for clear growth triggers (capacity/exports/new products) and cleaner, less volatile earnings before upgrading to Buy."
SHRADHA.NS,66,Hold,"Solid growth and profitability for a small-cap: 5Y revenue/profit growth strong, operating/net margins ~23%/17%, interest coverage ~13x, promoter holding ~75%. Valuation reasonable for growth (P/E ~28 but PEG ~0.21; P/B ~1.55; EV/EBITDA ~12.4). Risks: leverage appears moderate (quarterly D/E ~1–1.6 despite one anomalous figure), volatile quarterly revenue, very low liquidity, and missing ROE/OCF data. With industry context unknown, treat as a cautious Hold/accumulate on dips; upside if debt stays controlled and cash flows trend positive."
RKEC.NS,63,Hold,"Attractive valuation (P/E ~7.9, PEG ~0.49, P/B ~0.83, EV/EBITDA ~7.3) and strong 5Y growth (revenue ~26%, profit ~41%) with high and rising promoter holding (66.8%) position it well in India’s infra tailwind. However, ROE/ROCE are below par (~9.9%/4.8%), free cash flow is negative, interest coverage is modest (~2.8x), and quick ratio is weak—pointing to working-capital stress and execution risk. Debt is around ~1x equity but trending down; quarterly results are volatile; no known governance red flags. Multibagger potential exists if cash flows turn sustainably positive, ROCE improves >12%, and order wins strengthen. Accumulate cautiously on dips; upgrade to Buy on clear cash-flow/ROCE improvement."
HYBRIDFIN.NS,60,Hold,"Valuation is attractive (P/E ~16, PEG ~0.49, P/B ~1.33) with solid 5Y EPS/profit growth (~33%) and very high margins. Promoter holding is strong at 64%. However, leverage is high (D/E ~3.6; acceptable only if NBFC-like model), cash flow data is missing, and quarterly numbers show anomalies/volatility (including a negative revenue print), adding earnings-quality risk. Micro-cap size and very low liquidity further raise risk. With potential sector tailwinds and operating leverage, upside exists, but wait for clearer cash flow/ROE data and steadier revenue before upgrading to Buy."
NOVAAGRI.NS,72,Buy,"Small-cap with solid 5Y growth (revenue ~16.6% CAGR, profit ~26%, EPS ~27%), healthy margins (GM ~30%, OM ~10.6%, NM ~8.8%), and supportive promoter holding (59%). Interest coverage (~8.5x) and PEG (~0.58) suggest earnings growth at a reasonable price; P/E (~15.8) and P/B (~1.84) look attractive, EV/EBITDA (~10.5) is fair. Quarterly trends show volatile but improving YoY growth and operating leverage (~1.57) indicates profits can scale. Key caution: a single reported D/E of 24.9x conflicts with quarterly D/E (~0.25–0.32) and coverage; likely a data anomaly, but confirm leverage and cash flows before sizing up. Liquidity is low and ROE/FCF data missing. If leverage checks out, >15% CAGR over 3–5 years looks achievable; accumulate cautiously with position sizing."
ALANKIT.NS,58,Hold,"Pros: Solid 5Y growth (revenue ~33%, profit ~103%, EPS ~66%), acceptable interest coverage (~9x), promoter holding 54% (stable), and attractive valuation on P/E (18.6), PEG (~0.28), and P/B (~1.08). Low beta adds stability. Cons: Very high leverage (D/E ~3.6) and negative operating margin despite positive net margin—points to efficiency/accounting concerns; EV/EBITDA is elevated (~17.5); recent quarters show revenue deceleration and profit volatility; liquidity appears low. With missing ROE/OCF data not penalized, the setup looks like a cautious watchlist candidate rather than a buy. Triggers to upgrade: sustained margin improvement (turn OM positive), clear deleveraging, and consistent positive operating cash flow while maintaining growth >15% CAGR."
GOLDTECH.NS,58,Hold,"Attractive valuation (P/E ~13.9, PEG ~0.09, P/B ~2.07) with strong 5Y EPS/profit growth and solid promoter holding (~59%) suggest upside from a small base. However, financial quality is mixed: operating margin and EV/EBITDA are negative, quarterly profits are highly volatile with occasional losses, and reported debt-to-equity (~7.1) is a major risk despite overall interest coverage being healthy but inconsistent in quarters. Gross margins are thin, raising sustainability questions about net profitability. If leverage normalizes (<1–2x) and operating profitability stabilizes with consistent cash generation, this could re-rate; until then, treat as a speculative hold rather than a buy."
NARMADA.NS,60,Hold,"Strong 5Y growth (revenue ~23% CAGR, EPS ~66%, profit ~89%), positive margins (OM ~11%, NM ~6%), promoter holding ~50% and decent interest cover (~7x). Valuation looks reasonable for the growth (P/E ~23 with PEG ~0.35; P/B ~1.16), though EV/EBITDA ~17 is not cheap. Key risks: leverage data is inconsistent (headline D/E ~16.9 vs quarterly ~0.5–0.57), quarterly revenue is volatile, and liquidity is very low. ROE/FCF/pledge not provided—no penalty, but limits conviction. If D/E is truly <1 and cash flows are healthy, odds of a small-cap rerating improve; until verified, maintain Hold with an eye on balance sheet and cash generation."
SURANAT&P.NS,41,Avoid,"Pros: Attractive headline valuation (P/E ~12, PEG ~0.27, P/B ~1.85), strong and rising promoter ownership (~70.9%), low beta, and high reported interest coverage. EPS growth appears strong on a 5Y basis. Cons: Core operations look weak—negative operating margin, 5Y revenue contraction, extremely high EV/EBITDA (~134), and very high leverage (D/E ~3.77). Profit exceeds revenue and a single quarter shows outsized profit versus sales, implying one-offs/other income and low earnings quality. Quarterly profitability is volatile, and operating leverage is unfavorable. Cash flow data is missing (not penalized), but current evidence suggests earnings are not driven by core operations. Verdict: Not a clean, scalable compounding story yet. Monitor for deleveraging (D/E <1), sustained positive operating cash flow, normalization of margins (OM >8–10%), and revenue growth >15% driven by core business. If these improve, low P/B and promoter skin-in-the-game could enable rerating, but for now risk-reward is unfavorable."
BALAXI.NS,56,Hold,"Valuation is inexpensive (P/E ~12.5, P/B ~1.0, EV/EBITDA ~12.5) with strong promoter ownership (66%), healthy liquidity (current ratio ~3.9, quick ~2.2), solid interest cover (~10.8) and positive FCF (~₹396m). Operating margin (~21%) suggests a viable model if execution stabilizes. However, profitability is inconsistent (TTM net margin negative, ROE ~ -1.2%), 5Y growth trends are weak, and quarterly results are volatile with a recent revenue dip. Debt data are contradictory (annual D/E 9.6 vs quarterly 0.10–0.23); if leverage is actually low, upside improves; if high, it’s a red flag. Stock liquidity is also thin. Near-term stance: Hold and monitor for sustained positive margins/ROE >12–15%, clearer D/E (<0.5), and consistent growth >15%. Confirmation on debt and steady cash generation could make it an emerging value re-rating candidate; otherwise risk remains elevated."
HGM.NS,64,Hold,"Strong 5Y growth (revenue ~31% CAGR, profit ~25%) with healthy margins (OM ~18%, NM ~17%) and solid promoter holding (~50%). Valuation reasonable for a small-cap grower (P/E ~17.9, PEG ~0.71, P/B ~3.84, EV/EBITDA ~11). Interest coverage is very strong (~29x). However, leverage shows conflicting signals (headline D/E 5.84 vs quarterly ~0.05–0.07) and recent quarters show volatility/normalization after one outsized quarter; cash flow/ROE data not available. If leverage is actually moderate and growth sustains >15%, upside is significant; monitor debt clarity, cash flows, and consistency of quarterly execution before upgrading to Buy."
UYFINCORP.NS,66,Buy,"Undervalued micro-cap NBFC with strong 5Y profit CAGR (~54%), solid margins, high promoter holding (71%), attractive PEG (~0.42) and P/B (<1) indicate upside if growth sustains. Sector tailwinds in Indian credit deepen the runway. Risks: modest 5Y revenue CAGR (~10%), volatile quarterly results with a sharp spike, leverage at 1.67x (acceptable for NBFCs but watch underwriting), very low liquidity, and missing ROE/CF data. Overall, a cautiously optimistic, high-risk Buy suitable for small allocation; monitor asset quality, governance, and consistency of growth."
VMSTMT.NS,55,Hold,"Small-cap steel/TMT play with sector tailwinds and decent growth: 5Y revenue CAGR ~15.6% and profit CAGR ~28.9%. ROE is excellent (25.8%) and PEG is attractive (~0.84), aided by operating leverage. Promoter holding is strong (67%). However, financial risk is elevated: thin margins (OM ~8.3%, NM ~1.9%), weak ROCE (~7%), high leverage (D/E ~3.3–3.8x per recent quarters) with modest interest cover (~2x), weak quick ratio (~0.21) and sizeable negative FCF. Valuation looks rich for a cyclical (P/E ~24.4, EV/EBITDA ~14.9, P/B ~3.2) and quarterly profitability is volatile. If the company demonstrates sustained positive operating/FCF, deleverages (D/E <1.5, interest cover >3), and expands margins, upside could emerge; a pullback to more reasonable multiples would improve the risk-reward. For now, cautiously Hold rather than Buy."
INCREDIBLE.NS,71,Buy,"Undervalued microcap with improving profitability and strong promoter alignment. P/E ~14, PEG ~0.27, P/B ~1.38 and EV/EBITDA ~8.9 indicate attractive valuation relative to 5Y EPS/profit growth (~52%). Promoter holding is high (74.96%). Interest coverage (~5x TTM) is acceptable and quarterly D/E trends (~0.16–0.33) suggest manageable leverage; the single D/E value of 15.91 likely mis-scaled given coverage and quarterly data. Operating leverage (~4.2) offers upside if revenues grow. Risks: razor-thin margins (OM ~2.4%, NM ~1.84%), volatile quarterly prints, very low liquidity, and cash-flow data missing. Multibagger potential exists if margin expansion and cash conversion improve while growth sustains >15% CAGR. Cautious buy for high-risk investors; monitor cash flows, margin trajectory, and any pledging or client concentration."
NDL.NS,62,Hold,"Deep-value smallcap with improving topline but razor-thin margins. Positives: extremely cheap (P/E ~1.2, PB ~0.73, EV/EBITDA ~5, PEG ~0.02), promoter stake ~51%, improving recent profits/revenue, beta low, and D/E appears manageable (~0.4–0.6 from quarterly data). Negatives: very low operating/net margins (~2%/1%), 5Y profit decline, negative operating leverage, interest coverage ~2 (borderline), and cash flow/ROE not disclosed. No clear red flags provided, but verify cash flow quality and any one-offs behind EPS. Upside triggers: sustained positive OCF/FCF, margin expansion via value-added mix/capacity utilization, export tailwinds, and higher interest coverage (>3). Accumulate only on evidence of durable cash flows and margin improvement; otherwise hold."
ATAM.NS,68,Buy,"Strong 5Y growth (revenue ~44%, profit ~66%) with healthy margins and improving quarterly rebound; valuation attractive (PE ~15, PEG ~0.27, PB ~2.8, EV/EBITDA ~10.8) supporting >15% CAGR potential. Balance sheet appears sound: quarterly D/E ~0.33–0.41 and interest coverage 11–22x; promoter holding 52% is solid. Positives: operating leverage, dividend initiation, sector tailwinds for manufacturing/industrial demand. Cautions: micro-cap size and low trading liquidity, quarterly volatility, and missing FCF/ROE data (not penalized). If comfortable with small-cap risk and position sizing, this merits a cautious buy."
VASWANI.NS,60,Hold,"Attractive valuation and improving fundamentals, but thin margins and small-cap risks warrant caution. Positives: 5Y EPS/profit CAGR ~24%, PEG ~0.62, P/E ~14.9 and P/B ~1.23 are reasonable, EV/EBITDA ~9.3, promoter holding 62% and rising, interest coverage improving (~4x recent), signs of deleveraging (quarterly D/E trending down). Negatives: low net margin (~2.7%) and operating margin (~7.2%), revenue CAGR only ~3%, quarterly volatility, limited liquidity; cash-flow and ROE data not provided. Multibagger potential requires sustained deleveraging, margin expansion, and cash-flow strength; monitor for ROE >12–15%, interest cover >5x, and consistent OCF before upgrading to Buy."
BALAJEE.NS,66,Buy,"Undervalued small-cap with improving profits and strong promoter alignment. 5Y EPS growth ~39% and profit CAGR ~35% vs revenue ~9% plus high operating leverage indicate scalable earnings; PEG ~0.43, P/E ~17 and P/B ~1.42 look attractive. Margins are thin (OPM ~6.9%, NPM ~4.3%) and interest cover ~3.4 with quarterly D/E rising toward ~1.4 (the 60x figure appears inconsistent with quarterly data), so leverage and execution risk remain. ROE/FCF not provided, so not penalized. No visible governance red flags; promoter holding 65% is strong. Near-term volatility and low liquidity warrant position sizing, but growth vs valuation supports a cautious, high-risk buy for multibagger potential if debt is managed and margins hold."
DIGIDRIVE.NS,58,Hold,"Positives: Valuation looks attractive (PE ~17 with 5Y EPS CAGR ~30%, PEG ~0.57, PB ~0.40). Promoter holding is strong at ~59%. Leverage is moderate/comfortable (D/E ~0.31) with high interest coverage, and gross margin (~50%) suggests pricing power. Revenue trend is choppy but generally improving. Cautions: Operating margin is negative and EV/EBITDA is extremely high, indicating thin/volatile operating earnings and possible dependence on other income (one-off profit spike visible in quarterlies). Quarterly profitability is volatile; earnings quality needs verification. Microcap with low liquidity raises execution/exit risk. Missing ROE/OCF data isn’t penalized, but sustained positive and growing operating cash flow is essential to validate the thesis. Triggers to upgrade: consistent positive operating margin and OCF, steady profits without one-offs, visible order wins/capacity expansion or export traction, and clean governance (no pledges/related-party issues). Overall: potential if operating performance stabilizes; accumulate cautiously only after improving operating metrics."
JAYSREETEA.NS,54,Hold,"Deep-value small-cap with mixed quality. Positives: extremely low P/E (~3.5) and P/B (~0.65), PEG <0.1, strong 5Y profit growth, promoter holding ~51%, and low beta. Negatives: weak core operations (negative operating margin, EV/EBITDA ~20), volatile/seasonal earnings with reliance on non-operating income, and debt around ~0.8–1.1x with interest coverage ~3x. Industry growth tailwinds are modest for tea plantations; revenue CAGR ~7–8% suggests limited scalability. No clear red flags on governance in provided data, but earnings quality and cash-flow sustainability are concerns. Suitable as a value/watchlist idea; upgrade to Buy only if core EBITDA turns positive and stable, leverage trends down, and cash flows improve. Triggers: tea price upcycle, cost control, export tailwinds. Risks: commodity pricing, wage/monsoon shocks, low liquidity."
KRITIKA.NS,63,Hold,"Strong 5Y growth (revenue ~46%, profit ~36%) with acceptable leverage (D/E ~0.5–0.56) and solid promoter holding (63%) support a >15% CAGR potential. Valuation is reasonable (PE ~24, PEG ~0.67, PB ~2.4). However, extremely thin margins (OPM ~1.0%, NPM ~1.2%) and variable interest coverage (2.8–7.3x) make earnings fragile; liquidity also looks low. No clear red flags or cash-flow data provided, so not penalized. Prefer a Hold; potential Buy on signs of sustained margin/OCF improvement or product mix upgrade amid manufacturing/infra tailwinds."
ASHOKAMET.NS,56,Hold,"Pros: Valuation is attractive (P/E ~8.3, P/B ~0.38, PEG ~0.24), 5Y EPS/profit growth strong (~35–38%), promoter holding healthy at 53.6%, interest coverage improving (to ~9.5x quarterly), and recent quarters show higher scale vs earlier run-rate. These support an upside case if growth sustains. Cons: 5Y revenue decline (-16.5%) and negative operating leverage indicate fragile operating model; operating margin is low (~6.8%) while net margin is unusually high (~21%), suggesting reliance on non-operational factors; EV/EBITDA is elevated (~19x); very low liquidity (microcap) raises execution/exit risk. Key risk: debt metrics are inconsistent (annual D/E 12.6 vs recent quarterly ~0.1–0.16), which must be verified—leverage uncertainty plus volatility caps conviction. Outlook: With manufacturing tailwinds, a sustained revenue ramp could yield >15% CAGR and rerating, but only if operating cash flows improve and leverage is clarified. Action: Hold (speculative). Reassess after confirming true debt/pledge, cash flow trend, and sustainability of recent revenue jump; position size small and avoid if debt proves high."
MAHAPEXLTD.NS,44,Avoid,"Deep-value optics (P/E ~4.4, P/B ~0.3, PEG ~0.03) and strong promoter holding (62.5%) are positives, but earnings quality looks risky: 5Y revenue decline with outsized profit growth, highly volatile quarterly profits, and negative interest coverage suggest non-operating or unsustainable drivers. Key data gaps (ROE, debt, cash flow) limit confidence. Until there’s consistent revenue growth (>15%), positive and growing operating cash flow, and normalized interest coverage (>2x), risk of a value trap remains high despite cheap valuation."
MAWANASUG.NS,62,Hold,"Deep-value small-cap sugar play with potential upside if the cycle and ethanol tailwinds normalize, but earnings quality and leverage risks warrant caution. Positives: extremely cheap (P/E ~3.3, PEG ~0.05, P/B ~0.68, EV/EBITDA ~6.8), 5Y EPS/profit growth ~61%, net margin ~6.9%, low beta, high promoter holding (63.5%), and a strong dividend yield (~9%). Mixed/risks: operating margin negative on TTM with volatile quarterly profits and interest coverage; sugar is cyclical and policy-driven; overreliance on sugar segment. Debt-to-equity is ambiguous (series shows ~0.5–1.4, but one data point shows 85.2, likely an error); treat leverage as moderate-to-elevated until clarified. Triggers: ethanol blending recovery, better sugar realizations, possible exports, and deleveraging could rerate sharply. Suitable for value investors comfortable with commodity cyclicality; await clearer, sustained operating cash flow and margin recovery before an outright Buy."
WILLAMAGOR.NS,24,Avoid,"Micro-cap with promoter holding 62% and low beta are positives, but fundamentals signal high distress. Revenue trend is weak (5Y growth ≈ -52%) and TTM shows a massive loss with extreme volatility in quarterly profits, suggesting one-off hits or unstable operations. Interest coverage is deeply negative (-3557), P/B is negative (implies negative net worth), and EV/EBITDA is extremely high (~339), pointing to overvaluation relative to operating earnings despite a superficially low P/E and PEG (likely distorted by anomalies). Liquidity appears very low, heightening exit risk. Without evidence of debt resolution, sustainable cash flows, or a credible turnaround plan, the risk-reward is unfavorable."
DEVIT.NS,64,Buy,"Pros: Solid 5Y growth (revenue ~19% CAGR), improving profitability, and interest coverage ~11.5x suggest manageable leverage. Promoter holding is strong at ~66.6%, and valuation is reasonable (P/E ~16.5 below typical IT peers; P/B ~3.3 acceptable). PEG is very low, implying growth-adjusted value, though likely boosted by base effects. Industry tailwinds (digitalization/IT services) support a >15% CAGR runway. Cons: Thin margins (OM ~6.6%, NM ~7.5%), volatile quarterly profits with one-offs (a sudden spike then normalization), low liquidity, and EV/EBITDA ~27.6 is rich. The reported D/E appears inconsistent (headline very high) but quarterly D/E ~0.26–0.38 and strong coverage suggest moderate debt; treat leverage as acceptable. No cash flow data provided, so neutral there. Net: Cautiously optimistic small-cap buy for long-term investors, contingent on confirming normalized earnings and cash flow discipline; monitor for profit quality and liquidity risk."
GLOBECIVIL.NS,41,Avoid,"Positives: ROE ~26% (excellent), promoter holding 63% (strong), positive FCF, decent margins, EV/EBITDA ~8.3 and P/B ~2.9 reasonable for ROE. Concerns: Extremely high reported debt-to-equity (~146) with weak interest coverage (~2x) and ROCE ~9% indicate balance-sheet stress; quick ratio <1 suggests tight liquidity; 5Y revenue CAGR ~8% and negative EPS growth don’t justify P/E ~27; high operating leverage increases downside risk. Tailwinds from infrastructure spending exist, but unless leverage and coverage improve and growth accelerates, risk-reward is unattractive. Watch for deleveraging, stronger cash flows, and sustained order wins before considering a re-rating."
MURUDCERA.NS,66,Buy,"Undervalued small-cap tile maker with decent growth and skin-in-the-game promoters. 5Y growth solid (revenue ~18%, profit ~66%), operating leverage high (3.7x) and promoter holding strong (73.9%). Valuation attractive: PB ~0.69 and PEG ~0.43; PE ~26 and EV/EBITDA ~11 are reasonable vs growth and sector. Balance sheet appears acceptable with quarterly D/E ~0.3 (headline D/E likely mis-scaled), though interest coverage is thin (~1.6–3.8x) and margins modest (OM ~10%, NM ~4.8%). Quarterly performance is volatile; cash-flow/ROE data not provided (not penalized). Tailwinds from housing/renovation and potential export can re-rate if utilization and margins improve. Cautious accumulation advised, given small-cap risk and low coverage ratios."
SAGARDEEP.NS,38,Avoid,"Pros: High promoter holding (74%, rising), strong 5Y EPS/profit growth, reasonable P/B (1.6) and excellent PEG (~0.31) if growth sustains. Cons: Extremely high leverage (D/E ~19) with only modest interest cover (~3.2), razor-thin margins (OM ~1%, NM ~1.6%), rich EV/EBITDA (~26.5), and microcap liquidity risk. Revenue CAGR (~11%) is only moderate. With such thin margins and heavy debt, downside risk is high. Wait for visible deleveraging and margin expansion before considering; positive triggers would be debt reduction, sustained cash generation, and operating efficiency improvements."
