Symbol,Score,Verdict,Reasoning
MOTOGENFIN.NS,39,Avoid,"Positives: 5Y revenue growth ~18.6% from a small base; very low debt (D/E ~0.06) and decent interest coverage (~5x); promoter holding strong at 69.6%; PB ~1.2 offers downside support. Cautions: Valuation looks stretched (P/E ~141, EV/EBITDA ~50) despite modest margins (OM ~13%, NM ~7%) and lumpy quarterly profits; revenue is flat q/q; micro-cap liquidity is very low, raising execution and exit risk. No clear catalysts or evidence of high ROE yet (not provided). Net: While balance sheet is clean and ownership is aligned, earnings power and growth visibility don’t justify the valuation. Prefer to watch for sustained EPS/ROE improvement (>12–15%), consistent operating cash flow, and AUM/business expansion before reconsidering—ideally with P/E compressing to a more reasonable range or PEG <1.5."
ROSSELLIND.NS,62,Buy,"Undervalued small-cap with solid margins and high promoter skin-in-the-game. Positives: low P/E (~11.5) and P/B (~1.2) vs decent operating (21.6%) and net margins (10.4%), interest coverage ~7.6x, and likely D/E ~0.45 (strong). Promoter holding is very strong at 74.8%, and the defense engineering exposure offers structural tailwinds that can drive >15% CAGR if execution continues. Cautions: 5-year revenue/profit/EPS trends are negative, quarterly results are volatile with one loss-affected quarter, and cash flow data is missing. Execution risk and potential client concentration remain watch-outs. Overall, risk-reward is attractive for a patient investor; accumulate gradually and reassess on sustained growth and cash-flow traction."
21STCENMGM.NS,39,Avoid,"Positives: Promoter holding is strong at 64.4% with no pledge data provided, PB ~0.97 implies deep value, dividend yield ~4.15% is attractive, 5Y revenue CAGR ~18% suggests potential, and leverage appears minimal (quarterly D/E ~0). Negatives: Earnings quality is poor and volatile—TTM EPS is negative, quarterly revenue/profit show extreme swings (including negative revenue and a large one-off profit), margins are inconsistent, and EV/EBITDA is negative. Microcap size (~₹50 Cr) and very low liquidity add execution and exit risk. With limited clarity on the core business model and cash flows, and potential red flags from sudden income spikes, risk-reward is unfavorable. Monitor for 2–3 consecutive clean profitable quarters with positive operating cash flow and clearer revenue drivers; re-rate potential exists if profitability stabilizes given low PB and high promoter stake."
FMNL.NS,34,Avoid,"Undervaluation is evident (P/B ~0.53, EV/EBITDA ~5) and promoter holding is strong at ~67%, which keeps optionality alive. However, financial quality is weak: TTM EPS is negative, net margin is -14.6%, and leverage is very high (D/E reported extremely elevated; quarterly D/E also ranged ~1–6). Profitability is highly volatile with a sudden profit spike likely driven by one-offs, and interest coverage has been negative in some quarters despite a decent TTM figure. Revenue trends are broadly flat with no clear growth momentum; cash-flow data is not provided, so not penalized. Given debt risk, erratic earnings, and micro-cap illiquidity, the multibagger setup is currently weak. Reconsider if debt reduces, profits and operating cash flow turn consistently positive across several quarters, and any turnaround is backed by clean, recurring earnings."
GAYAHWS.NS,24,Avoid,"Micro-cap with very small and declining revenue base; operating margin negative and interest coverage ~1, indicating weak financial health. Reported profit massively exceeds revenue (likely one-off/exceptional), making PE and margins unreliable; negative P/B suggests accumulated losses/negative net worth. Quarterly numbers are highly volatile; liquidity is low and beta is high. A positive: strong promoter holding (~61%). Overall visibility on sustainable >15% CAGR is poor. Reconsider only if the company demonstrates recurring operating profits and cash flow, debt reduction, and consistent revenue scale-up with normalized margins."
GVPTECH.NS,51,Hold,"Pros: Strong 5Y revenue growth (~55%), very low debt (D/E ~0.08) with high interest coverage, promoter holding ~77%, and valuation appears undemanding (P/B ~0.91). Recent quarters show some recovery in revenue/profit. Cons: Company is loss-making on TTM basis (negative EPS, net margin ~-11%), EBITDA likely negative (EV/EBITDA < 0), highly volatile quarterly results, very low liquidity, and promoter holding declined (~-10 pp) suggesting possible dilution/selling. With limited visibility on ROE/OCF and business quality, treat as a speculative watchlist name. Upgrade to Buy only if it sustains profitable growth with positive operating cash flow, stabilizes margins, and shows credible order/capacity triggers without further dilution."
MORARJEE.NS,24,Avoid,"Microcap (~₹31 Cr) with severe financial stress and weak growth. TTM losses (EPS -44.9), very negative operating margin (~-134%), ROCE ~-5.8%, and negative interest coverage (-1.4) indicate distress. Liquidity is critically low (current ratio ~0.05, quick ~0.03), and negative P/B implies eroded net worth—making valuation ratios not meaningful. 5Y revenue growth is modest (~3%), offering little evidence of a scalable growth trajectory. Positives: strong promoter holding (59.7%), low beta, and positive recent free cash flow (~₹89 Cr), which could reflect working capital release, but sustainability is unclear given negative EBITDA. With thin trading liquidity and no visible growth catalysts in the data, risk of permanent capital loss is high. Avoid until clear turnaround signals: sustained positive EBITDA/OCF, improved liquidity (>1.0), restored equity, and stable interest coverage."
NEXTMEDIA.NS,32,Avoid,"Ultra‑low P/E appears driven by a one‑off gain (huge quarterly profit amid otherwise losses), while core operations show negative operating margin and erratic revenues (including zero‑revenue quarters). Book value seems negative (PB < 0), and EBITDA is negative (EV/EBITDA distorted), suggesting weak underlying economics despite a tiny market cap. Interest coverage swings widely and isn’t reliably strong. Positives: very high promoter holding (~75%) and modest 5Y revenue growth. However, lack of clear industry tailwinds, inconsistent profitability, illiquidity, and the sudden income spike are significant red flags. Prefer evidence of sustained positive operating cash flow, normalized profitability, and balance sheet repair before reconsidering."
ONELIFECAP.NS,27,Avoid,"Positives: 5Y revenue growth (~28%), promoter holding 52%, low P/B (~0.42) and low beta. Negatives (heavily): persistent losses (negative EPS and margins), negative/unstable interest coverage, erratic quarterly figures (including anomalies), very low liquidity, and uncertainty around leverage (conflicting D/E data). Valuation alone doesn’t offset financial risk. Not penalizing missing ROE/FCF, but on known metrics the turnaround isn’t evident. Revisit if the company delivers sustained positive EBITDA/OCF, cleaner quarterly trends, interest coverage >2, D/E sustainably <0.5, and margins >8–10%."
RVHL.NS,32,Avoid,"Positives: Reasonable valuation (PB ~1.5), manageable leverage (D/E ~0.46), high promoter holding (~74.7%), and improving sequential revenue with operating leverage suggesting potential scalability. Negatives: Loss-making (negative EPS), weak profitability (operating margin ~-19%), very poor interest coverage (deeply negative across quarters), and tiny revenue base relative to market cap, indicating execution and cash flow risk; liquidity also appears low. With key metrics like ROE, cash flow, and sustained profitability missing/negative, risk-reward is unfavorable today. Watch for 2–3 consecutive profitable quarters with positive operating cash flow, interest coverage >2x, and margin improvement (>10%) before reconsidering; any credible capacity expansion or anchor customer wins would be positive triggers."
SPENCERS.NS,22,Avoid,"Loss-making retailer with negative operating and net margins, negative interest coverage, and likely negative net worth (negative P/B), indicating stressed financials. Five-year revenue trend is down, and EBITDA/interest coverage remain negative. Positives: high promoter holding (58.8%), improving quarterly revenues with narrowing losses, low beta, and low price-to-sales. However, without sustained positive operating cash flow, debt service coverage >1x, and clear path to profitability, the risk outweighs upside. Keep on watchlist; re-evaluate if EBITDA turns positive, margins improve, and balance sheet strengthens."
UNIVASTU.NS,57,Hold,"Pros: Strong 5Y revenue (+43%) and profit (+26%) growth, healthy operating margin (~23.5%), adequate interest cover (~6.5x), and comfortable quarterly D/E (~0.44–0.68). Promoter holding is high at 67.5% and industry tailwinds (infra/capex) support growth. EV/EBITDA ~11 and P/B ~3.9 are acceptable if profitability sustains. Cons: P/E ~29 is rich for this segment; EPS 5Y trend negative suggests dilution/volatility. Quarterly results are uneven, liquidity is low, and ROE/FCF/pledge data are unavailable. Slight promoter holding reduction (-3.74%) and modest net margin (~6.6%) warrant caution. Verdict: Hold/watchlist. Upgrade to Buy on sustained cash-flow visibility (positive, growing OCF/FCF), ROE/ROCE >18%, stable D/E <0.5, and/or more attractive valuation (e.g., P/E ≤20 or EV/EBITDA ≤8) with continued execution."
AGROPHOS.NS,33,Avoid,"Positives: 5Y revenue growth ~16.7%, gross/operating margins decent (41%/19%), low PB (~1.25) and EV/EBITDA (~5.2), dividend yield 2.4%, and strong promoter holding (54%). Negatives (heavily weighted): very high reported debt-to-equity (~43x), negative interest coverage (TTM), and net loss, plus highly volatile/odd recent quarters (including a negative revenue print) indicate financial stress and data quality concerns. With profits and cash flow uncertain and leverage elevated, valuation is not a reliable cushion. Prefer to wait for evidence of deleveraging, sustained positive EBIT/OCF (ICR > 2), and stable profitability. Potential upside if balance sheet is repaired and growth normalizes, but risk-reward currently unfavorable."
AIRAN.NS,44,Hold,"Small-cap ITeS/digitization player with sector tailwinds and high promoter skin in the game (72% holding). 5Y profit CAGR (~24%) and operating leverage suggest upside if growth resumes. However, TTM EPS and net margin are slightly negative, quarterly earnings are volatile with a one-off spike, and leverage is elevated (D/E ~1.49) despite strong interest cover. Valuation is not obviously cheap (EV/EBITDA ~16.6; PB ~2) given current growth/margin profile. Not penalizing missing ROE/FCF data, but consistency is needed. Watch for 2–3 clean profitable quarters with positive operating cash flow and deleveraging (<1.0 D/E). Potential triggers: BFSI/government digitization contracts and margin improvement."
LANCORHOL.NS,46,Hold,"Pros: 5Y revenue CAGR (~22.7%) and operating margin (~13%) indicate potential; promoter holding strong at 51.7%; D/E trending <1 in recent quarters; PB ~0.83x gives asset-value support; EV/EBITDA ~9x is reasonable. Industry tailwinds (housing upcycle) could help a small regional developer. Cons: Earnings volatile; TTM net margin weak (~1%); interest coverage only ~1.5x (though improving to ~2x recently); very high headline P/E (~84x) implies rerating risk unless earnings inflect; low trading liquidity. No data on cash flow/ROE—neutral, not penalized. View: Watch for 2–3 consecutive quarters of positive free cash flow, sustained interest cover >2x, and steadier margins. If earnings normalize, valuation could rerate given sub-book pricing. Until then, speculative hold rather than a fresh buy."
PREMIERPOL.NS,45,Avoid,"Strengths: 5Y profit/EPS growth strong (~38%), healthy gross/op margins, high promoter holding (67.6%), solid interest coverage (~31x), and EV/EBITDA ~11.7 is reasonable. Risks: Very high leverage (D/E ~2.53), stretched valuation (P/E ~178, PEG ~4.6) not justified by 5Y revenue CAGR (~7.5%), small-cap with low liquidity, and volatile quarterly growth. Missing ROE/OCF data not penalized, but current price embeds high expectations. Prefer watchlist until deleveraging and/or sustained >15% growth drives EPS meaningfully or valuation compresses (P/E <25–30 or PEG <1.5)."
SONAMLTD.NS,38,Avoid,"Positives: Promoter holding is strong and rising (55.95% +0.8%), EPS growth ~17% 5Y meets the >15% CAGR target, and operating leverage is high (~3.8), suggesting profits could scale if revenues accelerate. Valuation is not excessive on PB (2.56) and PEG is borderline fair (~1.5). Negatives: Debt-to-equity is extremely high (~29x), a major red flag for a small, low-margin business (OM ~5%, NM ~5.4%) despite moderate interest coverage (~5.2x). Revenue growth (~6% 5Y) is tepid, EV/EBITDA (~14.7) is rich for a leveraged, thin-margin microcap, and liquidity looks low, adding exit risk. With ROE/FCF data missing, we won’t assume the worst, but the leverage alone warrants caution. Avoid for now; revisit on clear deleveraging (D/E <1), margin expansion (>10% OM), and sustained cash generation."
LAGNAM.NS,46,Hold,"Pros: Undemanding valuation (P/E ~11, P/B ~1.2, EV/EBITDA ~7.8), strong promoter ownership (68.5%), low beta, and solid 5Y revenue CAGR (~21%). These support optionality if cycle turns. Cons: High leverage (D/E ~3.2) with weak interest cover (~1.6x), thin margins (OM ~7.8%, NM ~2.3%), volatile quarterly profits, and negative operating leverage; 5Y EPS/profit trend is negative. No evidence of fraud or governance issues in provided data. View: Keep on watch; upside exists if the company deleverages and margins stabilize. Upgrade to Buy on sustained improvement: interest coverage >3x, D/E <1.5, consistent positive operating cash flow, and steady margin expansion with stable quarterly profitability or clear capacity/contract triggers. Until then, risk-reward is balanced but not compelling enough for a fresh Buy."
LPDC.NS,31,Avoid,"Micro-cap with very small and volatile revenue base, negative EPS and operating margin, and a large one-off quarterly loss. While 5Y revenue growth (~19%) and strong promoter holding (64.9%) are positives and gross margin is healthy (~43%), current profitability and cash-generation are weak (EV/EBITDA negative), and the stock appears expensive on likely P/S given tiny sales despite a reasonable P/B (2.7). Liquidity is very low, increasing risk. Missing leverage/cash-flow data isn’t penalized, but based on known metrics, visibility to >15% sustainable CAGR with sound cash flows is low today. Revisit if: sustained positive operating cash flow and profitability for 2–3 quarters, clearer growth runway (orders/capacity/product wins), margin stabilization, and valuation aligned to growth."
MAGNUM.NS,33,Avoid,"Positives: Promoter holding is strong (56.9%), balance sheet liquidity is acceptable (current ratio ~2.2), P/B is very low (~0.24) and EV/EBITDA (~5.7) is reasonable, with 5Y profit growth reported. Risks outweigh: very weak quality metrics (ROE ~0.6%, ROCE ~1.3%), negative operating margin, thin net margin (~1%), volatile quarterly profits including losses, and borderline interest coverage (~1x). P/E (~26.8) and PEG (~7.6) are not supported by growth, suggesting value trap risk despite low P/B. Debt picture is mixed (headline D/E appears high; recent quarterly D/E ~0.28–0.32) and cash-flow data is missing (not penalized). Until the company sustains positive operating margins, improves ROE >12% with >2x interest coverage and consistent operating cash flow, multibagger odds look low. Monitor for margin turnaround, deleveraging, and clearer growth catalysts before considering a re-rating."
SHEKHAWATI.NS,41,Avoid,"Micro-cap with low liquidity and inconsistent quarterly data. Positives: low P/E (~8), positive net margin (~14%), very high promoter holding (64% and rising), and strong reported interest coverage. Negatives: 5-year revenue decline (~-49%), high leverage (D/E ~2.7), valuation not clearly cheap on PB (~5) and EV/EBITDA (~18.9), and volatile quarter prints (including a negative quarter) raise quality-of-earnings concerns. Missing ROE/OCF data not penalized, but lack of clear growth runway and leverage risk keep risk-reward unfavorable. Watch for sustained revenue/profit growth with positive operating cash flow, deleveraging (D/E <1), and stable margins before reconsidering."
SOMATEX.NS,39,Avoid,"Positives: very low valuation (P/E ~3.9, P/B ~1.6) and strong promoter holding (~75%). However, core operations appear weak with negative operating margin/EBITDA, 5Y revenue decline (~12%), and high leverage (D/E ~1.84). Profitability looks distorted by a one-off quarterly spike, making the low P/E unreliable; liquidity is also low. Not penalizing missing OCF/ROE/pledge data, but on known metrics visibility to >15% sustainable CAGR is low and risk is elevated. Watch for sustained positive EBITDA/OCF, deleveraging (<0.8 D/E), and consistent double-digit revenue growth before reconsidering."
ZODIACLOTH.NS,38,Avoid,"Small-cap apparel player with strong promoter ownership (~71%) and reasonable leverage (D/E ~0.35–0.46) trading at a low P/B (~1.26). However, core fundamentals are weak: sustained losses (TTM net margin ~-21%), negative operating/interest coverage (-3 to -4), and volatile/slowing recent revenues. P/E/PEG not meaningful due to negative earnings; EV/EBITDA negative. While 5Y revenue CAGR (~11%) and high gross margin (~58%) suggest room for a turnaround via operating leverage, there is no clear evidence yet of profitability or positive cash flow. Risks include continued cash burn, potential dilution if losses persist, and low liquidity. Watchlist for proof of sustained positive EBIT/OCF, margin recovery, and steady double-digit revenue growth before considering. Positive triggers: cost rationalization, working-capital discipline, store/format optimization, and export/brand partnerships."
AAATECH.NS,57,Hold,"Positives: 5Y growth is solid (revenue ~21%, EPS/profit ~14–15%), healthy margins, debt-free recent quarters, high promoter holding (71.5%), and a modest dividend. These support a scalable, asset-light profile with sector tailwinds from ongoing digitalization. Negatives: Valuation looks rich (P/E ~33, PEG ~2.3, EV/EBITDA ~29) versus growth, quarterly results are lumpy, liquidity is thin (micro-cap risk), and key quality metrics like ROE/FCF aren’t available. No obvious red flags (dilution/pledge/controversies) in the provided data. Overall, decent long-term potential but current pricing and execution volatility warrant patience. Accumulate on dips or after clearer cash-flow/ROE evidence."
NECCLTD.NS,51,Hold,"Business/Growth: Operates in logistics where India’s infra push and formalization are tailwinds. Model is scalable but industry is fragmented; 5Y revenue CAGR ~9.5% is below the >15% target, though profit CAGR ~34% and operating leverage suggest earnings can scale if volumes improve. Leadership quality unknown; promoter stake is healthy at 54.2% (positive). Financials: Margins are thin (OM ~6.8%, NM ~2.6%) but improving; interest coverage ~2.9x TTM and rising each quarter. Reported D/E is inconsistent—quarterly D/E ~0.45–0.53 looks reasonable, so leverage appears acceptable. Cash-flow data not provided; not penalized. Valuation: Mixed. P/E ~24 and PEG ~2.6 look rich for 9–10% EPS growth, EV/EBITDA ~14.7 is high for logistics, but P/B ~0.9 is attractive and suggests downside support. Red flags: None obvious in governance; low liquidity and thin margins raise risk; cash-flow visibility is limited. Triggers: Sector tailwinds (National Logistics Policy, network/tech upgrades), operating leverage, potential market share gains. Overall: Potential exists, but current earnings multiples aren’t a bargain for the growth on display. Prefer monitoring for sustained >15% revenue growth, stronger cash conversion, ROE disclosure >12%, and continued deleveraging before upgrading to Buy."
SUMIT.NS,46,Hold,"Pros: Strong 5Y revenue CAGR (~31.6%), decent operating/net margins (14.7%/8.8%), promoter holding is high at 58% with slight increase, and PB at 2.44 is reasonable. These support a scalable growth story if execution sustains. Cons: Leverage is elevated (latest D/E trending ~1.6; interest coverage ~1.7x and weakening), quarterly results are volatile, valuation is not cheap for the risk (P/E ~29, EV/EBITDA ~17.4), beta >2 and liquidity is low—raising drawdown risk. Missing ROE/FCF data keeps us cautious, but not assumed negative. Verdict: Hold/Watchlist for now. Upgrade to Buy if deleveraging improves (D/E <1, interest cover >3x), operating cash flow turns consistently positive and grows, and growth remains >15% with margin stability."
ANKITMETAL.NS,22,Avoid,"Strong 5Y revenue growth (~48%) and high promoter holding (71%) are positives, but known financials signal distress: deeply negative operating (-52%) and net (-31%) margins, negative interest coverage, and a negative P/B implying eroded equity. Profits remain negative and valuation cannot be justified via PE/PEG or EV/EBITDA. Liquidity is very low, raising exit risk. No clear positive triggers provided. Not penalizing missing data, but the available metrics point to solvency and profitability concerns. Reconsider only if the company demonstrates sustained operating profitability and cash flow, interest cover >1, deleveraging, and restored positive net worth."
ATLANTAA.NS,39,Avoid,"Pros: reasonable valuation (PE ~15.6, PB ~2.05), strong promoter holding (74.7%), acceptable TTM interest coverage (~8.8), low beta. Cons: core operations weak (negative operating margin) with lumpy, non-linear profits (sudden spikes and loss quarters), 5Y revenue decline (~-34%), leverage appears elevated (quarterly D/E ~1.3–1.6; ignore the anomalous 148x figure), EV/EBITDA high (~17), and no clear growth triggers provided. Missing ROE/FCF data not penalized, but based on known metrics sustainability is questionable. Prefer clear improvement in operating margins, consistent cash flow, and reduced leverage before considering."
DGCONTENT.NS,38,Avoid,"Positives: Low valuation on PE (9.3) and EV/EBITDA (~5.1), strong promoter holding (66.8%), and sector tailwinds from digital content. Negatives: Extremely high leverage (D/E ~406) with volatile interest coverage (as low as 0.29x and 1.48x recently), wafer-thin operating margin (~0.3%) and volatile profitability (one negative quarter, sharp drop last quarter). Growth is modest (5Y revenue ~11%, profit ~5%) making the high P/B (~7.2) hard to justify; PEG ~1.9 is not attractive. Liquidity appears low. Missing ROE/OCF data not penalized, but known financial risk is high. Watch for deleveraging, sustained positive operating cash flow, improved margins and stable >15% CAGR before reconsidering."
RADIOCITY.NS,39,Avoid,"Turnaround story with improving quarterly trends but weak TTM fundamentals. Positives: promoter holding is strong (74%), price-to-book is low (~0.57) indicating asset-backed value, quarterly debt-to-equity appears reasonable (~0.2–0.25) despite one anomalous figure, and interest coverage improved to >2.5x in the latest quarter. Revenue 5Y CAGR (~11.7%) and operating leverage suggest upside if ad spending recovers. Negatives: TTM EPS and margins are negative, interest coverage is negative on TTM basis, and EV/EBITDA (~21.5) is rich for a loss-making business. Industry faces structural pressure from digital platforms and profits remain volatile. No clear red flags on governance, but cash flow data is missing. Not multibagger-ready yet; wait for 3–4 consecutive profitable quarters with positive operating cash flow and sustained coverage >2x. Monitor revenue momentum, margin stability, and any digital/expansion triggers before reconsidering."
ROML.NS,36,Avoid,"Micro-cap with 75% promoter holding and a fair headline P/E (~15) but fundamentals look fragile. Five-year revenue has slightly declined and profit growth is barely positive, margins are thin (OM ~4.7%, NM ~3.9%), and recent quarterly trend shows sharp deterioration culminating in a loss and negative interest coverage. Indicators suggest possible negative net worth (negative P/B and highly negative D/E in quarters), adding balance sheet risk. PEG is very high due to weak growth, EV/EBITDA ~14 is not cheap for current quality, beta is high (~2.8), and liquidity is low. No clear expansion or strategic triggers provided. Avoid for now; reconsider if the company restores positive EBIT/OCF, improves margins sustainably, returns to sequential revenue growth, and repairs the balance sheet (positive net worth, comfortable coverage). Promoter pledge and debt metrics are not provided—no penalty assumed."
IMPEXFERRO.NS,18,Avoid,"Severely stressed microcap. Revenue has collapsed over 5 years (~-91%) with negligible recent sales and persistent losses (TTM profit ~-7.1 Cr); ROCE negative and interest coverage deeply negative, alongside an extremely weak liquidity profile (current ratio ~0.03, quick ~0.01). Negative book value (PB < 0) and negative D/E signal eroded net worth; stock liquidity is very low. While promoter holding is high (~69%) and reported FCF is positive this year, this looks non-durable given tiny revenues. Valuation metrics are not meaningful with negative earnings/EBITDA; risk of dilution or insolvency outweighs potential cyclical tailwinds in ferro alloys. Only reconsider on clear turnaround: sustained revenue scale-up, positive EBIT/OCF for multiple quarters, improved working capital, and credible debt resolution."
